{"schemaVersion":"1.0.0","measurementVersion":"host-review-measurement/1.0.0","subjectId":"public-sample-a","context":"broader-source","protocolVersion":"host-review/1.0.0","inputDigest":"sha256:c998e5dc8cc404897126277ec923c726448cb422051c996c75ecc4cb34c308d5","estimatorVersion":"seed-rules/0.2.1","profile":"implementation","reviewerModel":{"isAvailable":true,"model":"openai-codex","version":"gpt-5"},"packetPayload":{"digest":"sha256:1d402fc693249c1a0c6d4c51506a373fe216b278f1b33262d8e42d1a16ca1f8e","size":{"utf8Bytes":39084,"characterCount":39084,"approximateTokens":9771}},"adjustmentPayload":{"digest":"sha256:3bac3366dc47a355e60aee4797109cf4b60fc69e37b41d76d92eb87dfc8664ea","size":{"utf8Bytes":6009,"characterCount":6009,"approximateTokens":1503}},"queries":[],"additionalInput":{"sizeReported":false,"size":{"utf8Bytes":0,"characterCount":0,"approximateTokens":0},"basis":"No additional input size was supplied by the caller."},"observedInput":{"utf8Bytes":39084,"characterCount":39084,"approximateTokens":9771},"observedInputComplete":false,"providerTokens":{"unavailableReason":"Telemetry was not supplied by the surrounding caller."},"elapsed":{"unavailableReason":"Telemetry was not supplied by the surrounding caller."},"cost":{"unavailableReason":"Telemetry was not supplied by the surrounding caller."},"conditions":{"sessionId":"m8-source-a","broaderSourceAvailableBeforeDecision":true,"referenceReviewAvailableBeforeDecision":false,"independentOfPairedReview":true,"notes":["Frozen public teacher targets predate the paired compact review; provider usage, duration, and exact additional-context size were not recorded."]},"decisions":[{"targetId":"work:architecture-design:1301c834bf26665d0695","decision":"replace","baselineCategory":"architecture-and-technical-design","baselineHours":{"low":0.75,"expected":1.50,"high":2.75},"reviewedCategory":"architecture-and-technical-design","reviewedHours":{"low":0.75,"expected":1.25,"high":2}},{"targetId":"work:build-tooling:c2c91d07e063088d401a","decision":"replace","baselineCategory":"build-configuration-and-developer-tooling","baselineHours":{"low":2.25,"expected":3.75,"high":6.50},"reviewedCategory":"build-configuration-and-developer-tooling","reviewedHours":{"low":1.5,"expected":2.5,"high":4}},{"targetId":"work:ci-infrastructure:bee22f5b9a094661eb75","decision":"replace","baselineCategory":"ci-cd-and-infrastructure-as-code","baselineHours":{"low":1.75,"expected":3.50,"high":6.75},"reviewedCategory":"ci-cd-and-infrastructure-as-code","reviewedHours":{"low":1.25,"expected":2,"high":3.5}},{"targetId":"work:javascript-source-backbone:2f5795bda39a0bae4a33","decision":"replace","baselineCategory":"production-implementation","baselineHours":{"low":2.00,"expected":4.50,"high":8.50},"reviewedCategory":"production-implementation","reviewedHours":{"low":2.75,"expected":4.5,"high":7.5}},{"targetId":"work:manual-validation:a0df1126ba2f8dbcb19b","decision":"replace","baselineCategory":"manual-validation-debugging-and-hardening","baselineHours":{"low":0.25,"expected":0.50,"high":1.00},"reviewedCategory":"manual-validation-debugging-and-hardening","reviewedHours":{"low":0.5,"expected":0.75,"high":1.25}},{"targetId":"work:packaging-release:58eb8ae7efef939a19b5","decision":"replace","baselineCategory":"packaging-deployment-and-release-artifacts","baselineHours":{"low":1.00,"expected":2.00,"high":3.75},"reviewedCategory":"packaging-deployment-and-release-artifacts","reviewedHours":{"low":1.25,"expected":2,"high":3.5}},{"targetId":"work:project-setup:e56be8fd4646c76f7cdd","decision":"replace","baselineCategory":"repository-and-solution-setup","baselineHours":{"low":1.25,"expected":2.00,"high":3.00},"reviewedCategory":"repository-and-solution-setup","reviewedHours":{"low":1,"expected":1.5,"high":2.5}},{"targetId":"work:specification-comprehension:49aec33b6a46fb626dad","decision":"replace","baselineCategory":"specification-comprehension-and-domain-learning","baselineHours":{"low":0.75,"expected":1.25,"high":2.25},"reviewedCategory":"specification-comprehension-and-domain-learning","reviewedHours":{"low":0.75,"expected":1.25,"high":2}},{"targetId":"work:unit-tests:875ec9f8d2f4b23af140","decision":"replace","baselineCategory":"unit-testing","baselineHours":{"low":5.75,"expected":10.25,"high":17.50},"reviewedCategory":"unit-testing","reviewedHours":{"low":3.75,"expected":6,"high":10.5}}],"baselineCategories":[{"category":"specification-comprehension-and-domain-learning","hours":{"low":0.75,"expected":1.25,"high":2.25}},{"category":"repository-and-solution-setup","hours":{"low":1.25,"expected":2.00,"high":3.00}},{"category":"architecture-and-technical-design","hours":{"low":0.75,"expected":1.50,"high":2.75}},{"category":"production-implementation","hours":{"low":2.00,"expected":4.50,"high":8.50}},{"category":"unit-testing","hours":{"low":5.75,"expected":10.25,"high":17.50}},{"category":"manual-validation-debugging-and-hardening","hours":{"low":0.25,"expected":0.50,"high":1.00}},{"category":"documentation","hours":{"low":0.50,"expected":1.00,"high":1.75}},{"category":"build-configuration-and-developer-tooling","hours":{"low":2.25,"expected":3.75,"high":6.50}},{"category":"ci-cd-and-infrastructure-as-code","hours":{"low":1.75,"expected":3.50,"high":6.75}},{"category":"packaging-deployment-and-release-artifacts","hours":{"low":1.00,"expected":2.00,"high":3.75}},{"category":"self-review-and-system-integration","hours":{"low":0.75,"expected":1.25,"high":2.25}}],"reviewedCategories":[{"category":"specification-comprehension-and-domain-learning","hours":{"low":0.75,"expected":1.25,"high":2.00}},{"category":"repository-and-solution-setup","hours":{"low":1.00,"expected":1.50,"high":2.50}},{"category":"architecture-and-technical-design","hours":{"low":0.75,"expected":1.25,"high":2.00}},{"category":"production-implementation","hours":{"low":2.75,"expected":4.50,"high":7.50}},{"category":"unit-testing","hours":{"low":3.75,"expected":6.00,"high":10.50}},{"category":"manual-validation-debugging-and-hardening","hours":{"low":0.50,"expected":0.75,"high":1.25}},{"category":"documentation","hours":{"low":0.50,"expected":1.00,"high":1.75}},{"category":"build-configuration-and-developer-tooling","hours":{"low":1.50,"expected":2.50,"high":4.00}},{"category":"ci-cd-and-infrastructure-as-code","hours":{"low":1.25,"expected":2.00,"high":3.50}},{"category":"packaging-deployment-and-release-artifacts","hours":{"low":1.25,"expected":2.00,"high":3.50}},{"category":"self-review-and-system-integration","hours":{"low":0.75,"expected":1.25,"high":2.25}}],"baselineTotal":{"low":17.00,"expected":31.50,"high":56.00},"reviewedTotal":{"low":14.75,"expected":24.00,"high":40.75},"privacy":{"repositoryIdentityCopied":false,"promptTextCopied":false,"sourceTextCopied":false,"querySelectorsCopied":false,"callerSuppliedTextRetained":true,"disclosureNotice":"EffortHours does not copy repository identity, prompts, query selectors or reasons, adjustment rationale or evidence IDs, paths, or source text. Caller-supplied subject/session IDs, telemetry bases, and condition notes are retained verbatim and must be non-sensitive."}}