{"schemaVersion":"1.0.0","measurementVersion":"host-review-measurement/1.0.0","subjectId":"public-sample-c","context":"compact","protocolVersion":"host-review/1.0.0","inputDigest":"sha256:a32c7fca13716554bd71a24b7ec690f052c0379dda8674ef09fd4f24fb5e279e","estimatorVersion":"seed-rules/0.2.1","profile":"implementation","reviewerModel":{"isAvailable":true,"provider":"openai","model":"codex","version":"session-build-undisclosed"},"packetPayload":{"digest":"sha256:f6471ceaa830c29bec1a126065b37a915c4e06a1f19209d57015dc10642b40cf","size":{"utf8Bytes":42686,"characterCount":42686,"approximateTokens":10672}},"adjustmentPayload":{"digest":"sha256:5083b908ffed8f1bf90e437d767609f9ff318f9c28f32637e3083f8a7d84836b","size":{"utf8Bytes":4177,"characterCount":4177,"approximateTokens":1045}},"queries":[{"kind":"capability","containsSourceExcerpt":false,"payload":{"digest":"sha256:ee6e3ac194f49b2a8d41c34dc602fbf989f1107644d9c7a700fe1ab83defc77d","size":{"utf8Bytes":5280,"characterCount":5280,"approximateTokens":1320}}}],"additionalInput":{"sizeReported":false,"size":{"utf8Bytes":0,"characterCount":0,"approximateTokens":0},"basis":"No additional input size was supplied by the caller."},"observedInput":{"utf8Bytes":47966,"characterCount":47966,"approximateTokens":11992},"observedInputComplete":false,"providerTokens":{"unavailableReason":"Telemetry was not supplied by the surrounding caller."},"elapsed":{"unavailableReason":"Telemetry was not supplied by the surrounding caller."},"cost":{"unavailableReason":"Telemetry was not supplied by the surrounding caller."},"conditions":{"sessionId":"m8-compact-c","broaderSourceAvailableBeforeDecision":true,"referenceReviewAvailableBeforeDecision":true,"independentOfPairedReview":false,"notes":["This was not a blind context-isolation run; broader source and aggregate reference results were available beforehand."]},"decisions":[{"targetId":"work:architecture-design:1301c834bf26665d0695","decision":"affirm","baselineCategory":"architecture-and-technical-design","baselineHours":{"low":0.75,"expected":1.50,"high":2.75},"reviewedCategory":"architecture-and-technical-design","reviewedHours":{"low":0.75,"expected":1.50,"high":2.75}},{"targetId":"work:build-tooling:c2c91d07e063088d401a","decision":"affirm","baselineCategory":"build-configuration-and-developer-tooling","baselineHours":{"low":2.50,"expected":4.00,"high":6.75},"reviewedCategory":"build-configuration-and-developer-tooling","reviewedHours":{"low":2.50,"expected":4.00,"high":6.75}},{"targetId":"work:ci-infrastructure:bee22f5b9a094661eb75","decision":"affirm","baselineCategory":"ci-cd-and-infrastructure-as-code","baselineHours":{"low":2.00,"expected":4.00,"high":7.50},"reviewedCategory":"ci-cd-and-infrastructure-as-code","reviewedHours":{"low":2.00,"expected":4.00,"high":7.50}},{"targetId":"work:documentation:bebbc838ff439c1b4e49","decision":"replace","baselineCategory":"documentation","baselineHours":{"low":4.25,"expected":7.25,"high":12.00},"reviewedCategory":"documentation","reviewedHours":{"low":7,"expected":12,"high":18}},{"targetId":"work:javascript-source-backbone:2f5795bda39a0bae4a33","decision":"replace","baselineCategory":"production-implementation","baselineHours":{"low":47.25,"expected":105.75,"high":198.00},"reviewedCategory":"production-implementation","reviewedHours":{"low":40,"expected":80,"high":145}},{"targetId":"work:manual-validation:a0df1126ba2f8dbcb19b","decision":"replace","baselineCategory":"manual-validation-debugging-and-hardening","baselineHours":{"low":0.25,"expected":0.50,"high":1.00},"reviewedCategory":"manual-validation-debugging-and-hardening","reviewedHours":{"low":0.5,"expected":1,"high":2}},{"targetId":"work:packaging-release:58eb8ae7efef939a19b5","decision":"affirm","baselineCategory":"packaging-deployment-and-release-artifacts","baselineHours":{"low":1.00,"expected":2.00,"high":3.75},"reviewedCategory":"packaging-deployment-and-release-artifacts","reviewedHours":{"low":1.00,"expected":2.00,"high":3.75}},{"targetId":"work:specification-comprehension:49aec33b6a46fb626dad","decision":"affirm","baselineCategory":"specification-comprehension-and-domain-learning","baselineHours":{"low":0.75,"expected":1.25,"high":2.25},"reviewedCategory":"specification-comprehension-and-domain-learning","reviewedHours":{"low":0.75,"expected":1.25,"high":2.25}},{"targetId":"work:unit-tests:875ec9f8d2f4b23af140","decision":"replace","baselineCategory":"unit-testing","baselineHours":{"low":22.00,"expected":40.50,"high":68.00},"reviewedCategory":"unit-testing","reviewedHours":{"low":30,"expected":50,"high":78}}],"baselineCategories":[{"category":"specification-comprehension-and-domain-learning","hours":{"low":0.75,"expected":1.25,"high":2.25}},{"category":"repository-and-solution-setup","hours":{"low":1.00,"expected":1.75,"high":2.75}},{"category":"architecture-and-technical-design","hours":{"low":0.75,"expected":1.50,"high":2.75}},{"category":"production-implementation","hours":{"low":47.25,"expected":105.75,"high":198.00}},{"category":"unit-testing","hours":{"low":22.00,"expected":40.50,"high":68.00}},{"category":"manual-validation-debugging-and-hardening","hours":{"low":0.25,"expected":0.50,"high":1.00}},{"category":"documentation","hours":{"low":4.25,"expected":7.25,"high":12.00}},{"category":"build-configuration-and-developer-tooling","hours":{"low":2.50,"expected":4.00,"high":6.75}},{"category":"ci-cd-and-infrastructure-as-code","hours":{"low":2.00,"expected":4.00,"high":7.50}},{"category":"packaging-deployment-and-release-artifacts","hours":{"low":1.00,"expected":2.00,"high":3.75}},{"category":"self-review-and-system-integration","hours":{"low":0.75,"expected":1.25,"high":2.25}}],"reviewedCategories":[{"category":"specification-comprehension-and-domain-learning","hours":{"low":0.75,"expected":1.25,"high":2.25}},{"category":"repository-and-solution-setup","hours":{"low":1.00,"expected":1.75,"high":2.75}},{"category":"architecture-and-technical-design","hours":{"low":0.75,"expected":1.50,"high":2.75}},{"category":"production-implementation","hours":{"low":40.00,"expected":80.00,"high":145.00}},{"category":"unit-testing","hours":{"low":30.00,"expected":50.00,"high":78.00}},{"category":"manual-validation-debugging-and-hardening","hours":{"low":0.50,"expected":1.00,"high":2.00}},{"category":"documentation","hours":{"low":7.00,"expected":12.00,"high":18.00}},{"category":"build-configuration-and-developer-tooling","hours":{"low":2.50,"expected":4.00,"high":6.75}},{"category":"ci-cd-and-infrastructure-as-code","hours":{"low":2.00,"expected":4.00,"high":7.50}},{"category":"packaging-deployment-and-release-artifacts","hours":{"low":1.00,"expected":2.00,"high":3.75}},{"category":"self-review-and-system-integration","hours":{"low":0.75,"expected":1.25,"high":2.25}}],"baselineTotal":{"low":82.50,"expected":169.75,"high":307.00},"reviewedTotal":{"low":86.25,"expected":158.75,"high":271.00},"privacy":{"repositoryIdentityCopied":false,"promptTextCopied":false,"sourceTextCopied":false,"querySelectorsCopied":false,"callerSuppliedTextRetained":true,"disclosureNotice":"EffortHours does not copy repository identity, prompts, query selectors or reasons, adjustment rationale or evidence IDs, paths, or source text. Caller-supplied subject/session IDs, telemetry bases, and condition notes are retained verbatim and must be non-sensitive."}}