{"schemaVersion":"1.0.0","measurementVersion":"host-review-measurement/1.0.0","subjectId":"public-sample-b","context":"broader-source","protocolVersion":"host-review/1.0.0","inputDigest":"sha256:938b8db99b65e832cd174db3400664eec968094cb67ece29a8df6470b287f06e","estimatorVersion":"seed-rules/0.2.1","profile":"implementation","reviewerModel":{"isAvailable":true,"model":"openai-codex","version":"gpt-5"},"packetPayload":{"digest":"sha256:478b6a36e8ea0047b7f3c6d5476d505815b7e128a3b874575549de5c83043f9d","size":{"utf8Bytes":72697,"characterCount":72697,"approximateTokens":18175}},"adjustmentPayload":{"digest":"sha256:ddf8cb24188959eca9ce4b4724c87ceb1907ce19954b26df6e603e896d8bf02f","size":{"utf8Bytes":8339,"characterCount":8339,"approximateTokens":2085}},"queries":[],"additionalInput":{"sizeReported":false,"size":{"utf8Bytes":0,"characterCount":0,"approximateTokens":0},"basis":"No additional input size was supplied by the caller."},"observedInput":{"utf8Bytes":72697,"characterCount":72697,"approximateTokens":18175},"observedInputComplete":false,"providerTokens":{"unavailableReason":"Telemetry was not supplied by the surrounding caller."},"elapsed":{"unavailableReason":"Telemetry was not supplied by the surrounding caller."},"cost":{"unavailableReason":"Telemetry was not supplied by the surrounding caller."},"conditions":{"sessionId":"m8-source-b","broaderSourceAvailableBeforeDecision":true,"referenceReviewAvailableBeforeDecision":false,"independentOfPairedReview":true,"notes":["Frozen public teacher targets predate the paired compact review; provider usage, duration, and exact additional-context size were not recorded."]},"decisions":[{"targetId":"work:architecture-design:2baf06b5c25cb9711fe5","decision":"replace","baselineCategory":"architecture-and-technical-design","baselineHours":{"low":0.75,"expected":1.50,"high":2.75},"reviewedCategory":"architecture-and-technical-design","reviewedHours":{"low":1,"expected":1.5,"high":2.5}},{"targetId":"work:documentation:bebbc838ff439c1b4e49","decision":"replace","baselineCategory":"documentation","baselineHours":{"low":4.00,"expected":6.75,"high":11.00},"reviewedCategory":"documentation","reviewedHours":{"low":6,"expected":10,"high":16.5}},{"targetId":"work:dotnet-source-backbone:0e62be7c6d2d8617652b","decision":"replace","baselineCategory":"production-implementation","baselineHours":{"low":40.25,"expected":71.75,"high":125.50},"reviewedCategory":"production-implementation","reviewedHours":{"low":43.75,"expected":70,"high":114}},{"targetId":"work:dotnet-source-backbone:82c6f462b95679cc72e3","decision":"replace","baselineCategory":"production-implementation","baselineHours":{"low":10.00,"expected":18.00,"high":31.75},"reviewedCategory":"production-implementation","reviewedHours":{"low":5.25,"expected":8,"high":13.5}},{"targetId":"work:dotnet-source-backbone:bff334a3ff0bfc0ff2f6","decision":"replace","baselineCategory":"production-implementation","baselineHours":{"low":8.00,"expected":14.75,"high":25.75},"reviewedCategory":"production-implementation","reviewedHours":{"low":4,"expected":6,"high":10}},{"targetId":"work:manual-validation:13a1d5c2bbf0fa759582","decision":"replace","baselineCategory":"manual-validation-debugging-and-hardening","baselineHours":{"low":0.25,"expected":0.50,"high":1.00},"reviewedCategory":"manual-validation-debugging-and-hardening","reviewedHours":{"low":2.5,"expected":4,"high":6.5}},{"targetId":"work:manual-validation:2f30231effeda20fa0c4","decision":"replace","baselineCategory":"manual-validation-debugging-and-hardening","baselineHours":{"low":0.75,"expected":1.75,"high":3.50},"reviewedCategory":"manual-validation-debugging-and-hardening","reviewedHours":{"low":0.5,"expected":1,"high":1.75}},{"targetId":"work:manual-validation:760419422c64b12f8328","decision":"replace","baselineCategory":"manual-validation-debugging-and-hardening","baselineHours":{"low":0.75,"expected":1.75,"high":3.50},"reviewedCategory":"manual-validation-debugging-and-hardening","reviewedHours":{"low":0.5,"expected":1,"high":1.75}},{"targetId":"work:manual-validation:8080ab37fe1b4f3b2481","decision":"replace","baselineCategory":"manual-validation-debugging-and-hardening","baselineHours":{"low":0.75,"expected":1.75,"high":3.50},"reviewedCategory":"manual-validation-debugging-and-hardening","reviewedHours":{"low":1.25,"expected":2,"high":3.5}},{"targetId":"work:self-review:e943a6db2e8c464b145a","decision":"replace","baselineCategory":"self-review-and-system-integration","baselineHours":{"low":2.50,"expected":4.25,"high":7.50},"reviewedCategory":"self-review-and-system-integration","reviewedHours":{"low":4.5,"expected":7,"high":11}},{"targetId":"work:specification-comprehension:49aec33b6a46fb626dad","decision":"replace","baselineCategory":"specification-comprehension-and-domain-learning","baselineHours":{"low":2.00,"expected":3.50,"high":6.25},"reviewedCategory":"specification-comprehension-and-domain-learning","reviewedHours":{"low":2.5,"expected":4,"high":6.5}},{"targetId":"work:unit-tests:a6ad88961efa60e9f48e","decision":"replace","baselineCategory":"unit-testing","baselineHours":{"low":20.25,"expected":37.75,"high":63.00},"reviewedCategory":"unit-testing","reviewedHours":{"low":27,"expected":44,"high":71.5}}],"baselineCategories":[{"category":"specification-comprehension-and-domain-learning","hours":{"low":2.00,"expected":3.50,"high":6.25}},{"category":"repository-and-solution-setup","hours":{"low":6.50,"expected":10.50,"high":16.50}},{"category":"architecture-and-technical-design","hours":{"low":3.50,"expected":6.50,"high":12.00}},{"category":"production-implementation","hours":{"low":61.75,"expected":110.50,"high":193.25}},{"category":"unit-testing","hours":{"low":20.25,"expected":37.75,"high":63.00}},{"category":"manual-validation-debugging-and-hardening","hours":{"low":2.50,"expected":5.75,"high":11.50}},{"category":"documentation","hours":{"low":4.00,"expected":6.75,"high":11.00}},{"category":"build-configuration-and-developer-tooling","hours":{"low":1.75,"expected":2.75,"high":4.75}},{"category":"ci-cd-and-infrastructure-as-code","hours":{"low":1.00,"expected":2.00,"high":3.75}},{"category":"packaging-deployment-and-release-artifacts","hours":{"low":1.00,"expected":2.00,"high":3.75}},{"category":"self-review-and-system-integration","hours":{"low":2.50,"expected":4.25,"high":7.50}}],"reviewedCategories":[{"category":"specification-comprehension-and-domain-learning","hours":{"low":2.50,"expected":4.00,"high":6.50}},{"category":"repository-and-solution-setup","hours":{"low":6.50,"expected":10.50,"high":16.50}},{"category":"architecture-and-technical-design","hours":{"low":3.75,"expected":6.50,"high":11.75}},{"category":"production-implementation","hours":{"low":56.50,"expected":90.00,"high":147.75}},{"category":"unit-testing","hours":{"low":27.00,"expected":44.00,"high":71.50}},{"category":"manual-validation-debugging-and-hardening","hours":{"low":4.75,"expected":8.00,"high":13.50}},{"category":"documentation","hours":{"low":6.00,"expected":10.00,"high":16.50}},{"category":"build-configuration-and-developer-tooling","hours":{"low":1.75,"expected":2.75,"high":4.75}},{"category":"ci-cd-and-infrastructure-as-code","hours":{"low":1.00,"expected":2.00,"high":3.75}},{"category":"packaging-deployment-and-release-artifacts","hours":{"low":1.00,"expected":2.00,"high":3.75}},{"category":"self-review-and-system-integration","hours":{"low":4.50,"expected":7.00,"high":11.00}}],"baselineTotal":{"low":106.75,"expected":192.25,"high":333.25},"reviewedTotal":{"low":115.25,"expected":186.75,"high":307.25},"privacy":{"repositoryIdentityCopied":false,"promptTextCopied":false,"sourceTextCopied":false,"querySelectorsCopied":false,"callerSuppliedTextRetained":true,"disclosureNotice":"EffortHours does not copy repository identity, prompts, query selectors or reasons, adjustment rationale or evidence IDs, paths, or source text. Caller-supplied subject/session IDs, telemetry bases, and condition notes are retained verbatim and must be non-sensitive."}}